{
  "finding_id": "line_delta:FALCON-2026-07A:FF-8011",
  "disposition": "dispute",
  "justification": "The shipment record shows 700 kg billed weight and 800 km distance, standard service, no special handling. Recomputing under the contract: 700 kg falls squarely in the 501-2,000 kg band (\u00a71) at \u20b924/km, giving base freight for 800 km; the express premium (\u00a72) correctly does not fire since service_level is standard, not express; the 12% fuel surcharge (\u00a73) applies to the base freight only. No accessorial applies since special_handling is empty (\u00a74). This reconstruction matches the pipeline's expected_amount exactly and is not near any contract boundary ambiguity (700 kg is well inside the 501-2,000 band, not near the 500/501 kg gap noted in the rate card's ambiguities). The billed amount exceeds this correctly-derived figure, and \u00a75's whitelist means no other accessorial or charge is payable absent a prior written rate confirmation, none of which is evidenced here. This is a clear, determinable overcharge.",
  "governing_clauses": [
    "falcon-freight.md \u00a71",
    "falcon-freight.md \u00a73"
  ],
  "memo_narrative": {
    "what_happened": "Falcon billed consignment FF-8011 (700 kg, Mumbai-Bengaluru, 800 km, standard service) above the amount that the contract's base freight and fuel surcharge formula supports.",
    "why": "Recomputing base freight under \u00a71's 501-2,000 kg band and the \u00a73 fuel surcharge on top reproduces a lower figure than billed, with no applicable express premium (\u00a72) or accessorial (\u00a74) to explain the gap, and \u00a75 bars any other uncontracted charge.",
    "recommended_action": "Request a corrected invoice from Falcon Freight for FF-8011 citing \u00a71 and \u00a73, and raise the dispute within the 45-day window under \u00a77."
  }
}