{
  "finding_id": "line_delta:FALCON-2026-07A:FF-8005",
  "disposition": "dispute",
  "justification": "The pricing trace correctly applies the contract to this shipment: 260 kg billed weight falls unambiguously within the 'up to and including 500 kg' band (\u00a71) at \u20b918/km over the 800 km lane, the express service premium of 15% applies per \u00a72 (service_level is express), and the 12% fuel surcharge compounds on base freight plus the express premium per \u00a73. No accessorial (\u00a74) fired since special_handling is empty, and \u00a75 bars any charge outside the schedule. This chain reproduces the expected amount exactly, leaving the billed amount unsupported by any contract mechanism. Unlike the fractional-weight ambiguity noted elsewhere in the rate card, 260 kg is squarely inside the lower band with no boundary issue, so there is no genuine interpretive gap here \u2014 the overcharge is a clean, determinable billing error.",
  "governing_clauses": [
    "falcon-freight.md \u00a71",
    "falcon-freight.md \u00a72",
    "falcon-freight.md \u00a73",
    "falcon-freight.md \u00a75"
  ],
  "memo_narrative": {
    "what_happened": "Falcon billed consignment FF-8005 (260 kg, Mumbai\u2013Bengaluru, 800 km, express) above the amount that the contract's freight, express premium, and fuel surcharge formula produces.",
    "why": "Recomputing base freight under \u00a71's sub-500kg band, the \u00a72 express premium, and the \u00a73 fuel surcharge in sequence yields a lower total than billed, and \u00a75 prohibits any charge outside this schedule, so the excess above the amount above is not contractually supported.",
    "recommended_action": "Raise a billing dispute with Falcon citing \u00a71\u2013\u00a73 and \u00a75, requesting either a corrected invoice or an explanation for the excess charge on FF-8005, within the 45-day dispute window under \u00a77."
  }
}