{
  "finding_id": "line_delta:FALCON-2026-07A:FF-8005",
  "disposition": "dispute",
  "justification": "The pricing trace correctly applies the contract: a 260 kg consignment falls squarely within the 'up to and including 500 kg' band (\u00a71) at \u20b918/km over the 800 km lane, express service adds the 15% premium (\u00a72) on base freight, and the 12% fuel surcharge (\u00a73) compounds on base freight plus the express premium, per the contract's own wording. No accessorial (\u00a74) fired since special_handling is empty, and \u00a75 states no other accessorial charges are payable absent a written rate confirmation, none of which is in evidence here. The billed amount exceeds this fully-supported, unambiguous calculation by the delta shown, with nothing in the shipment facts, contract, or evidence explaining the excess. This is a straightforward overcharge, not an ambiguous rate-band or classification question.",
  "governing_clauses": [
    "falcon-freight.md \u00a71",
    "falcon-freight.md \u00a72",
    "falcon-freight.md \u00a73",
    "falcon-freight.md \u00a75"
  ],
  "memo_narrative": {
    "what_happened": "Falcon billed consignment FF-8005 (260 kg, Mumbai to Bengaluru, 800 km, express) above the amount the contract's freight, express premium, and fuel surcharge clauses support, with no accessorial charge applicable.",
    "why": "Reconstructing the charge from \u00a71 (weight-band per-km rate), \u00a72 (15% express premium), and \u00a73 (12% fuel surcharge) using the actual shipment facts yields a lower, fully contract-supported figure, and \u00a75 bars any other charge without a prior written rate confirmation, which is not present here.",
    "recommended_action": "Raise a billing dispute with Falcon citing \u00a71\u2013\u00a73 and \u00a75, and request a corrected invoice for consignment FF-8005 within the 45-day window under \u00a77."
  }
}